index,text,label_text,label_code,tweet_id
714,"Nobody said you had no right to your body. Were advocating equal rights, which isnt being recognized in the case of abortion; youre denying the preborns RTL.",Strongly believe abortion should be illegal,-2,1519778068092493824
715,"Reporters say abortion wasnt brought up. And no, Joe has no suddenly changed his views on these issues. Get serious.",Neutral to abortion rights/restrictions,0,1454161006821888003
716,"RT On this, the 49th anniversary of Roe v Wade and, likely, the last before reproductive rights are put out of reach for much of the country, re-upping how much is at stake for women athletes ",Strongly believe abortion should be legal,2,1485044429257940994
717,"Ton site est tres credible ... LifeSiteNews was founded for the purpose of opposing legal abortion, and that remains a primary focus. C'est ce que je disais .. CROYANCE vs SCIENCE",Strongly believe abortion should be illegal,-2,1511489019623968774
718,One more fun fact not so fun Road. Republican anti-abortion activist Howard Scott Heldreth is a convicted child rapist in Florida.. And the list goes on..,Neutral to abortion rights/restrictions,0,1536726552934723584
719,One of my teachers (a nun) at a Catholic university in an anatomy class once told us. The only foolproof form of birth control is to become a nun. Then after she stared out the window she told us that sometimes that didnt even work. Lol,Neutral to abortion rights/restrictions,0,1478031478411956234
720,RT Texas is urging the Supreme Court to leave in place its law banning most abortions and telling the justices theres no reason to rush into the case. ,Neutral to abortion rights/restrictions,0,1451356339574394882
721,So where would you draw the line? Following safety precautions during a pandemic? Getting vaccinated? Abortion? Sedition? Are the limits what you determine based on your values? We don't know anything about this situation but you're free to judge?,Neutral to abortion rights/restrictions,0,1534032852274270208
722,The anti-abortion constitutional amendment #SB956 passed out of Committee 7-4 Thank you for working to protect Pennsylvanians,Strongly believe abortion should be illegal,-2,1486015386151792641
723,Even animals know how to treat babies! Pro-choice feminists feminists could learn a lot from this dog!! ,Strongly believe abortion should be illegal,-2,1513403254587084803
724,Very curious whether Schumer even brings the House abortion bill over for a vote. With language like this and the radical late-term language he might not even get 50 votes. ,Strongly believe abortion should be illegal,-2,1442547858759041025
725,RT Apparently even the Democrat in yesterdays special election was pro-life. Abortion culture isnt popular with Hispanics.,Slightly believe abortion should be illegal,-1,1537133181119365121
726,A lady will risk complications of abortion cause of a photoshoot? ,Neutral to abortion rights/restrictions,0,1496207999584681985
727,things get more and more diabolical in each episode. did yall know Mother Teresa used a segment of her Nobel Prize acceptance speech to liken abortion to genocide? truly a lovely woman (/s).,Strongly believe abortion should be illegal,-2,1490280096556593153
728,"RT Its time to get rid of shame & stigma about abortion! So heres some alternatives to saying: you dont have to like abortion, or you dont have to approve of abortion, or even you can be disgusted by abortion, but you have to respect other peoples choices: ",Strongly believe abortion should be legal,2,1537415232376786944
729,RT Women are officially 2nd class citizens in America now with Roe v. Wade overturned. The very basic right to control your body is lost. Its a scary time to be a woman in America & Ill support you with everything I can.,Strongly believe abortion should be legal,2,1521639059734552577
730,And by rule I mean it's going to be EXTREMELY funny to watch all these companies do the cha cha slide around abortion rights and all the laws trying to back slide gay rights.,Strongly believe abortion should be legal,2,1525253057361190913
731,Factually inaccurate. The modern abortion movement was inserted into the Womens Right Movement in 1960s. Do your research rookie!,Neutral to abortion rights/restrictions,0,1531072636905836546
732,Why are bringing abortion into this?? Who is talking about abortion?? Ok I get it you support the elite class leaders... Good luck,Neutral to abortion rights/restrictions,0,1451209090768654343
733,Liberals argue that not wearing a mask kills people at risk. Thats their perspective. You believe abortion kills babies. Thats your perspective. Neither perspectives give you the right to dictate body autonomy. Its as simple as that,Strongly believe abortion should be legal,2,1487296093062930435
734,"RT The Missouri Abortion Fund provides public education and support for people needing reproductive health services, primarily by providing financial assistance to Missouri residents who cannot afford the full cost of abortion care. ",Strongly believe abortion should be legal,2,1437142918112894987
735,"RT Anti abortion states: get ready for a brain drain of perinatal providers and maybe even emergency docs. You just turned your state into an unacceptable risk state, cutting off life-saving interventions from their medical arsenal. Professional risk insurance will be unaffordable.",Strongly believe abortion should be illegal,-2,1522717025843437568
736,"RT Since 1973, when Roe v. Wade gave women power and autonomy over their reproductive healthcare choices, women have had: Higher relationship stability Higher wages More work experience An increase in overall health and well-being Pro-choice IS pro-life. #DemVoice1 ",Strongly believe abortion should be legal,2,1530552429036679174
737,"Wait wait wait, since the right wants to take away a woman's right to choose and make abortion illegal, wouldn't this be considered to be dangerous to his ability to have kids and shouldn't this then be illegal? I mean, since they are the party of pro-birth, it seems that any",Strongly believe abortion should be legal,2,1489048360187314176
738,"True, shell find some feminist dude to trick her into getting an abortion after tricking her into letting him nut inside her.",Slightly believe abortion should be illegal,-1,1449102658963390464
739,RT The Senate is going to bring up a slightly different bill securing abortion rights a couple of times a week until the midterms right? RIGHT? ,Strongly believe abortion should be legal,2,1525209406211870720
740,"Kurt Schrader potentially losing is sad. There should be room for fiscal hawks in our party. Cuellar, I'll be pleased to see go. Abortion shouldn't be controversial. ",Neutral to abortion rights/restrictions,0,1524859770095558657
741,Libertarians need to get their act together. Their notions about abortion and freedom just don't align right. They could have had way more conservatives come to their side if they would have stopped choosing craziness.,Slightly believe abortion should be illegal,-1,1485070066572042242
742,"Again, be straight, don't call it ""healthcare"" when it's not. Please tell us what abortion actually is?",Slightly believe abortion should be illegal,-1,1518571868441169922
743,"RT .installed two homophobic, transphobic, anti-choice zealots in his admin and seems determined to install more. Join members of NYC's LGBTQIA2S+ communities, including the NY City Council LGBTQ Caucus, to take a stand. #EricBeAnAlly #RescindTheAppointments #NoToCabrera ",Strongly believe abortion should be legal,2,1496589514109820935
744,So the Democrat voters didnt care they gave the radical RW 3 extremists justices that now are going to overturn roe . So they didnt care about abortion rights ? And now they do ? ,Strongly believe abortion should be legal,2,1531707461777899527
745,RT These FORCED BIRTH States threatening to convict a woman who goes to another state for an Abortion are INSANE! Whats next? Convicting someone who smokes pot in CA because its illegal in their own home State? #DemVoice1 #VoteBlue2022,Strongly believe abortion should be legal,2,1524530412273295361
746,"RT Her reputation has been damaged by these spurious charges. Her life may be in danger because forced-birth advocates have little issue with doing violence in the name of ""pro-life"". She's been jailed and persecuted. I hope she sues the shit out of everyone",Strongly believe abortion should be legal,2,1513277170210291716
747,I barely recognize myself when I first went on birth control. I felt so out of control of my own body that it made me relapse,Slightly believe abortion should be legal,1,1521196557864898560
748,"Unpopular opinion on this thread but if people who dont have uterus cant have an opinion on abortion, the people who dont own a gun cant have an opinion on gun control",Slightly believe abortion should be illegal,-1,1530580492168339459
749,"1. Abortion is irresponsible, as it is the neglect of one's responsiblity in creating a child through killing it. If you are unable to care for the child there is always adoption, which is always a better alternative to death. The mother is responsible for giving birth.",Strongly believe abortion should be illegal,-2,1467767096834723840
750,RT Think about that: Anti-abortion activists are actively organizing *right now* to harass people in Texas. They're financially-motivated to do so. Facts don't matter. People will harass people during their darkest and most difficult days. (15/18),Strongly believe abortion should be legal,2,1435389418030968833
751,RT Iron Rule of Tomassi #5: NEVER allow a woman to be in control of the birth.,Strongly believe abortion should be illegal,-2,1521222012160692224
752,"@TheJusticeDept @POTUS Is abortion against the law in Canada? In Canada, there is no criminal law relating to abortion. Abortion care decisions are made between the woman and her health care provider, within the context of a universal health care system.",Strongly believe abortion should be legal,2,1516129983948894212
753,RT #SB8 is the most extreme abortion ban in the country and it has devastated abortion access in Texas. This 50% decline is just the start if this ban is allowed to stay in effect. #BansOffOurBodies ,Strongly believe abortion should be legal,2,1454125759266709517
754,RT Why is a germ considered life on Mars but an unborn baby in the womb isn't considered life on Earth?,Slightly believe abortion should be illegal,-1,1450187696052244488
755,This is a pretty callous way of talking about the reality of abortion before it was made safe and legal. We can add sexism to the list of reprehensible causes that you are adjacent to or outright advocate for.,Slightly believe abortion should be illegal,-1,1453023479410929684
756,"RT Legal abortion is one of the greatest public health advances weve ever had. While we now have safe abortion pills as an option no matter what, making abortion illegal is a total disaster!",Strongly believe abortion should be legal,2,1510048815436349447
757,So vaccine mandates are an infringement of Americans but denying a womens rights to decide on an abortion is not?,Strongly believe abortion should be legal,2,1466539891190292485
758,"RT Two-thirty comes during Testifying. It's Janine, telling about how she was gang-raped at fourteen and had an abortion. But whose fault was it? Aunt Helena says, holding up one plump finger. Her fault, her fault, her fault. We chant in unison. Who led them on? She did. She did.+",Strongly believe abortion should be legal,2,1540484679106953221
759,"RT I am officially banning abortion ban states. I will not visit, do business with, or vacation in those states. Nope. Nada. There needs to be economic consequences for these radical so called pro-life phonies. Who's with me?",Strongly believe abortion should be legal,2,1541562597480226819
760,That starts with celebrating the fact that we as a society can legally kill an unborn baby at full term. Liberals have literally held parades in New York celebrating the ability kill a partial born child.,Strongly believe abortion should be illegal,-2,1533980581561872384
761,"RT MAGA: ""All I'm sayin is if we gotta choose between an American baby and an immigrant baby, a true patriot would let the immigrant baby starve first."" ""That's your opinion on the baby formula shortage?"" MAGA ""Yeah, as you can see I'm very pro-life.""",Neutral to abortion rights/restrictions,0,1525234634665218048
762,"No We need senators who have integrity and decency, who have the courage to actually defend living, breathing CHILDREN. If not, you are not ""pro-life"" at all. Oh, and FYYFF. ",Neutral to abortion rights/restrictions,0,1531057813522223104
763,"RT Merciful fates, the disease is spreading. #WomensHealth #Choice ",Neutral to abortion rights/restrictions,0,1503868903004545032
764,"RT Ok, Im angry. Im angry that two excellent abortion providers are forced to crowdfund in order to open a desperately needed clinic. Im angry that theyve only raised 37k towards their 250k goal. People need to STEP UP for ",Strongly believe abortion should be legal,2,1523071042419183617
765,I read that Repugs are saturating Spanish radio with ads bad mouthing Dems and anti-abortion etc. Dems are doing NADA! Why?,Strongly believe abortion should be legal,2,1537312536319565824
766,"It's also weird how anti-choicers claim to be anti-rape, but are fine with men and fetuses raping utetus-bearing people because ""it's a baby"". The anti-choice movement is made of sexual predators, abusers, terrorists, and hypocrites. #ProLifersAreHypocrites #KeepAmericaProChoice",Strongly believe abortion should be legal,2,1514296244121718785
767,"White women immediately ran to the streets when it got leaked Roe-v-Wade was going to be overturned, but where was this energy back in 2020? White women are doing the same shit white gays did with gay marriage.",Neutral to abortion rights/restrictions,0,1526966391924047874
768,"The ever-popular Republican/evangelical Christian platform of ""pro-life until you're born, but then you're screwed"" and ""pro-gun in case I want to kill something"". Makes perfect sense, and is clearly Biblical...or not.",Neutral to abortion rights/restrictions,0,1499913297323245571
769,RT Joel Osteen's Lakewood Church service interrupted by abortion activists stripping down to demonstrate via @chron,Neutral to abortion rights/restrictions,0,1533979661331443714
770,Im pro-life and I agree with you and most prolife people I know also agree with you.,Strongly believe abortion should be illegal,-2,1497971575919886342
771,"Nope. Actual fact. Abortion laws limit access to healthcare that is a fact. Multiple republicans have sided with putin and his invasion of ukraine. Fact. Republicans censor schools black history teaching, sexual health teaching, and queer identity teachings. All fact.",Strongly believe abortion should be legal,2,1511394546407464961
772,"I'm from Japan. When is comes to Tx., are you against new law that ban abortion?Are you interested in Paris? If so you can bid my pins related to Tokyo Olympic game. ",Neutral to abortion rights/restrictions,0,1451380096556617730
773,"RT Wish and their members were as concerned about protecting Al Schmidt and his family as they are about security for B. Kavanaugh - who unlike Schmidt, is set to deny human rights + relegate America's women to reproductive slavery.",Strongly believe abortion should be legal,2,1536488122653057025
774,"RT The Virginia Senate, which has a 1 seat Democratic majority, has just shut down a Republican attempt to enact a restrictive 20-week abortion ban.",Strongly believe abortion should be legal,2,1492270909280845825
775,"Alexandra, this is an inexplicable comment even for you on this subject. The op-ed said IF men could get pregnant, abortion would not be an issue. How do you get that to mean that men can get pregnant and have abortions?",Neutral to abortion rights/restrictions,0,1445498149817049101
776,RT Is that the solution? Bitter truth is; if a girl is determined to terminate a pregnancy even if you deny her access to these drugs she will unfold a hanger or use sticks to get rid of the pregnancy. In my opinionlimiting access to abortion pills has never been a solution. ,Strongly believe abortion should be legal,2,1479010254327365632
777,Update you can see the entire video on YouTube way before she rushes the motorcade which was 80 cars deep lol Go watch it. She is mad about abortion being banned so good cause bad execution.,Strongly believe abortion should be legal,2,1534772457642545152
778,"There are really only three relevant types of cases: 1. Rape, abortion should be legal as no consent was every given 2. Risk of life to the mother, abortion should be legal 3. I got drunk and fucked a stranger, no sorry",Slightly believe abortion should be legal,1,1541902233582706688
779,Just a reminder: birth control was made with a very specific bmi in mind. Those of us who have side effects or whatever are bc we fall outside of that bmi ,irrelevant or no opinion on abortion,99,1473347143201177600
780,RT CW: there is some disturbing and upsetting imagery on the side of these buses. Homophobia and anti-abortion bullshit within,Neutral to abortion rights/restrictions,0,1445393112646492178
781,"They are really guncrazy at the NRA. Weapons for the insane, assaultrifles for 18year old, even younger ?? Yes lets do the nuke thing. Regulation ? Are you crazy ? They have nothing to do with abortion.",irrelevant or no opinion on abortion,99,1530591133033803776
782,"Fascinating 2c ""pro-choicers"" here jumping up & down for hours - so much nastiness. But it's hopeful that none want to come out & openly say ""abortion kills unborn babies"". An implicit admission that abortion would be horrific if that were true. A start. Next comes love of truth.",Strongly believe abortion should be illegal,-2,1502411133927493634
783,RT The New York Times: Poland Shows the Risks for Women When Abortion Is Banned. ,Neutral to abortion rights/restrictions,0,1536101710250266624
784,RT NEW: The demonstrations that briefly disrupted last night's abortion debate resulted in 25 cabortion rights activists getting one-year bans from the Florida House. Police also arrested a Planned Parenthood organizer. For @TB_Times: ,Neutral to abortion rights/restrictions,0,1494410569859936261
785,A reminder that Leela Aheer and the UCP walked out BEFORE the vote on a proposed bill that would keep patients and staff safe from harassment at abortion clinics in 2018. She doesnt get to rewrite history now that shes in the leadership race. Shes not an ally. #AbLeg ,Strongly believe abortion should be legal,2,1540482201082396672
786,"RT Disney is now a ""Has Been"". The most innocent among us are killed (abortion) and now, the very youngest are being groomed sexually by ungodly grown ups. Disgusting.",Strongly believe abortion should be illegal,-2,1509549193173639174
787,"RT GP I'd say the right is whatever the state legislature defines it as. If abortion's not mentioned in the US Constitution (it's not) and it's not a natural right (it's not), unless it's guaranteed in the state constitution it's up to the legislature to permit or deny it. ",Neutral to abortion rights/restrictions,0,1537806345591726080
788,RT Congratulations to John Reynolds-Wright and Sharon Cameron at NHS Lothian/University of Edinburgh for winning our David Bromha,irrelevant or no opinion on abortion,99,1461302471297486850
789,"Abortion is not reproduction. It's the opposite. ""Pro choice"" Catholics isn't a real thing. You are one or the other. (P.S. This tweet's for everyone!)",Strongly believe abortion should be illegal,-2,1534650976430325761
790,I do not mean to single out the left only with the pro-choice example. Just the most in our face.,Neutral to abortion rights/restrictions,0,1446540940764659716
791,"Yes. If Miranda is just ""prophylactic"", what is the source of the Court's power to announce the rule? An analogy would be if the viability rule in Roe was just ""prophylactic"" to protect an underlying constitutional right to abortion whose contours remain unclear and undefined.",Strongly believe abortion should be legal,2,1510621161595547660
792,"Only if you de-humanize the unborn. The pro-abortion side gives zero value to a new like prior to birth, others disagree.",Slightly believe abortion should be illegal,-1,1451879193411833859
793,"RT There 3 things at issue: 1, every vaccine was developed by using fetal stemcells, some may still use them in the vaccine still. To me that's commercialization of abortion, as a Christian I will not condone that. 2, I don't want it, and the gov. can't force you. 3, it doesn't work",Strongly believe abortion should be illegal,-2,1454985088404533252
794,"RT What's next? Abortion rights in a country where it is still criminalized. Today women will be pushing HARD for Ser Ley to be upheld in the constitutional assembly, and for access to be passed by lawmakers and guaranteed by state institutions. #8M2022 ",Strongly believe abortion should be legal,2,1501178101694353448
795,"RT BREAKING: The Oklahoma House passed SB1503, a 6-week abortion ban identical to the Texas ban It will take effect immediately after Gov. Kevin Stitt signs it, nullifying Roe v. Wade in a second state and creating a ""massive ripple effect"" across the region ",Neutral to abortion rights/restrictions,0,1520847342739419136
796,RT New York Governor Asks Facebook To Censor Pro-Life Misinformation About Abortion via @dailycaller,Strongly believe abortion should be legal,2,1437561918953250819
797,RT This is horrible. Abortion is murder. Abolish abortion. ,Strongly believe abortion should be illegal,-2,1511394980765454341
798,RT Just maybe if these woman who March for abortion would take into consideration that the day after pill is in rape kits. Just maybe it would help to get woman to report rape and avoid pregnancy. Technology has come a long way. Its not the 1950s. IMO.,Slightly believe abortion should be legal,1,1444674027369504775
799,The Texas abortion bill is a heartless bill. No allowance made for the health of the baby. All that money wasted and the heartbreak of carrying an unviable child. Heartbreaking.,Strongly believe abortion should be legal,2,1486101519288225797
800,"RT #NationalStrike to demand abortion rights, healthcare for all, a living wage, and so much more. Congress is no longer a viable route.",Strongly believe abortion should be legal,2,1522000457916293120
801,Absolutely. Margaret Sanger herself publicly stated that planned parenthoods abortion clinics were integral to eliminating undesirable genetics from the American gene pool.,Neutral to abortion rights/restrictions,0,1518069751481741313
802,"Does that also apply to the side-effects of said vaccines, as well as the side-effects of abortion during a so-called pandemic? #genocide",Strongly believe abortion should be illegal,-2,1477092871148916739
803,The new messiah came out against abortion and he hates who they hate.,Strongly believe abortion should be illegal,-2,1503725569061629961
804,"RT A beautiful tribute to Sarah Weddington on the anniversary of Roe v. Wade, by ",Neutral to abortion rights/restrictions,0,1485015976680767489
805,RT Pro-Life activist shared her disappointment with the disrespectful behaviour of some of the pro-abortion counter protesters at the 2022 March for Life. She added that she wouldn't try to shut down a pro-choice event. ,Neutral to abortion rights/restrictions,0,1525202199239966721
806,"RT ""This right of privacy, whether it be founded in the Fourteenth Amendment's concept of personal liberty and restrictions upon state action..[or] in the Ninth Amendment..is broad enough to encompass a woman's decision whether to terminate her pregnancy"" Roe v Wade,410 US 113, 153 ",Strongly believe abortion should be legal,2,1485103358268612611
807,Like forcing people to stay pregnant against their will. Exactly. Thats why Im pro-choice and why I will always speak up against anti-choice lies.,Strongly believe abortion should be legal,2,1504776925985886209
808,"RT Sharing abortion stories is a personal and vulnerable experience, and effective in eradicating abortion and reproductive stigma thats why on June 13th, were showing up on social media to share #OurAbortionStories. Learn more: ",Strongly believe abortion should be legal,2,1535261634226184197
809,I HAVE READ THAT ABORTION RIGHTS ARE TO BE EXTENDED UP TO 28 DAYS AFTER !! BIRTH !.,Neutral to abortion rights/restrictions,0,1524889229188386833
810,"RT Immigration - people die Child hunger - people die Denial of health care coverage - people die Guns - people die #COVID19 - people die Right to life over abortion is a fig leaf, but clearly a lie. Meet the real republican party, the party of death.",Strongly believe abortion should be legal,2,1466181718877032449
811,"RT Austin designer + illustrator created a zine with a history of abortion restrictions in Texas & why we are marching this Saturday, October 2nd! Download the digital zine: https://t.co/Oxh6WIkIVd Join our fight for at the Texas Capitol from 9am-12pm #WMATX2021 ",Strongly believe abortion should be legal,2,1445074053635756032
812,"Absolutely. Abortion removes fathers from the picture unless the mom actively seeks to include him, ultimately leaving women alone with responsibility of the child. That extends to married couples who are offered abortion for fetal anomaly - women alone make that ""choice"".",Slightly believe abortion should be illegal,-1,1475878254376591366
813,Probably trying to make sure no woman goes to Mexico for an abortion.,Slightly believe abortion should be illegal,-1,1503478985891667972
814,RT Medication abortions are really the only abortion at 6 weeks or earlier. Somebodys looking for headlines be,Neutral to abortion rights/restrictions,0,1435389444119351302
