index,text,label_text,label_code,tweet_id
419,"RT The library believes, f**k that, knows everyone deserves access to quality healthcare including abortion. This ain't funny, and we should have said it sooner.",Strongly believe abortion should be legal,2,1514753992965902343
420,"RT If the Democrats lose the House next year, everything that was passed in 2021 & 2022 dies in 2023 Pandemic stimulus, protecting voting & reproductive rights, LGBTQ protections, gun laws, etc., are all done #wtpBLUE #wtp1024 ",Strongly believe abortion should be legal,2,1444295191632904194
421,RT please explain to me how an aggressive round of chemo is safe for my unborn baby but not a glass of wine,Neutral to abortion rights/restrictions,0,1474951764038221825
422,"RT And the take is wrong at its base level. I'm no academic or scholarly researcher, so I don't have empirical data, but I don't think people whose sole issue was abortion are going to suddenly stop voting. They'll shift the goal posts and see how much farther they can go.",Neutral to abortion rights/restrictions,0,1466855184605212675
423,RT U.S. doctors see spike in vasectomies following end of Roe v. Wade: report ,Slightly believe abortion should be legal,1,1542641041945333762
424,Exactly... I'll bet you lost your mind when Texas enacted the abortion rule. So eff you and your hypocrisy.,Slightly believe abortion should be illegal,-1,1437508004727951361
425,RT I spent $2200 in Massy. This is a birth control tweet.,Slightly believe abortion should be legal,1,1453409011643133952
426,What are you doing to increase foster care budgets? Specially while you are supporting making abortion illegal?,Neutral to abortion rights/restrictions,0,1542645735883247616
427,RT The Supreme Courts leaked draft decision on Roe v. Wade proves that these justices dont care much for precedent which means key climate change decisions could be next. Thats one reason why we mean it when we say: reproductive justice is climate justice. Period.,Strongly believe abortion should be legal,2,1528418419246125056
428,"RT I commend for his strong leadership during these challenging times. Pleased President Biden supports a filibuster exemption to codify Roe v. Wade into law. Help us elect two more Dem US Senators and hold the House, and we will get this done. ",Strongly believe abortion should be legal,2,1542636298925576193
429,RT The good folks over at are liberating history from the white cishetero patriarchy. We to see it! this piece from about the feminist self-help movement & the way it helped people take power over their bodies in a pre-Roe world: ,Strongly believe abortion should be legal,2,1486096684971184130
430,"The politicians who endorse pro-life are overwhelmingly not that. You've probably been told this before, but making abortions illegal will do little to reduce how many happen. If you want that you'll need to promote safe sex ed and contraception, which isn't popular in that crowd",Strongly believe abortion should be legal,2,1541905208757862400
431,"RT So many asking, ""What can I do right now?"" GET THESE IN YOUR HOUSE NOW: 1. Birth control 2. Emergency contraception 3. Medication abortion pills. Find it all here: https://t.co/xVWfQgBBG0 #RoeVWadeprotest #roevwade #bansoffourbodies",Strongly believe abortion should be legal,2,1540482757100462080
432,"I know they exist. I wasn't for the Texas abortion ban tactics for the reasons listed and I'm not sure I'm in favor of Newsome mirroring those tactics.I believe there will be unseen,tragic consequences. Will gun nutz recognize a political ploy when they c 1 ?",Neutral to abortion rights/restrictions,0,1470171530357317634
433,RT The Satanic Temple released a statement arguing they will fight in court for the right to religious abortion. https:/,Strongly believe abortion should be legal,2,1524901910867693569
434,Maybe some sort of opposition will emerge from this. I'm very pro-life and would support a candidate on this. A (new) party with traditional values/pro-life/sensible economic polices could clean up. Agree with answering to the people (don't hold your breath).,Strongly believe abortion should be illegal,-2,1518576409723158532
435,Just keep it legal because abortion will always be here. Poor woman will get back alley abortions like they used to and rich women will find drs to perform them.,Strongly believe abortion should be legal,2,1467201678914949121
436,"As much as I agree with your abortion view, you can't abolish this just because they disagree with your views. Your views are yours. Their views are theirs. They are just as entitled to share their views as anyone else",Slightly believe abortion should be legal,1,1445374136444932096
437,RT Can you believe by Thanksgiving of next tear abortion could be illegal in America? Actually it will have been illegal,Slightly believe abortion should be legal,1,1463709570891599878
438,"RT Obama ""Is it the one that forces poor nuns to pay for the free abortion insurance? Should the fees be so high that the healthy come to bankruptcy before becoming ill? Should government open more schools? Should corporations hire more innovation officers?"" ",irrelevant or no opinion on abortion,99,1535491447910064133
439,"RT A 15-week abortion ban is NOT a compromise. It's a partisan, subjective, medically unnecessary restriction on critical health care.",Strongly believe abortion should be legal,2,1499820271406092291
440,"It's easy to pick apart isolated examples, cuz you will always find some misinformation somewhere. But if u take a step back and look at the overall data about this, we can conclude that banning abortions does cause a lot of death and suffering among women ",Slightly believe abortion should be legal,1,1447607491286552578
441,"And to be technical,abortion is not illegal in Texas,its just mostly illegal and their trick to get around the constitutionality of it all.Should frighten everyone. If this precedence is set, what would stop California from enacting a similar vigilante law, for guns?",Slightly believe abortion should be legal,1,1454588611568054278
442,"RT If you believed there were just as many negative stories, you would understand why adoption is not an alternative to abortion.",Strongly believe abortion should be legal,2,1496021094222172160
443,"RT 5 years ago when moving to Austin, I worried about accessing the healthcare I needed due to the states politics, including",Strongly believe abortion should be legal,2,1449416230788554757
444,"Embryo is the correct terminology, not baby, and there is a passage in numbers on how to have an abortion. Yes, alive, born from term infants you can't kill. That's not an embryo nor fetus.",Strongly believe abortion should be legal,2,1508360148544364546
445,Da Fuq???? How can people be so brainwashed that they terminate their pregnancy based on the weather???,Slightly believe abortion should be illegal,-1,1515957341400743940
446,RT The lone abortion clinic in Mississippi is warning the Supreme Court that any move to undermine a half century of legal precedent,Strongly believe abortion should be legal,2,1438258428066111492
447,"RT The GOP talks about pro-life like they actually care about the lives of women, children and the vulnerable and yet they dont give a damn about what they advocate as long as they are pleasing the Christian Crusade and the NRA that is in their pocket books.",Strongly believe abortion should be legal,2,1529244571502354440
448,"RT Parties with a 'conscience' position on abortion and LGBTQ+ rights defend it as giving MLAs a choice. But if those MLAs and candidates refuse to say which way they would vote on these issues, how can we trust them with that choice? We can't.",Strongly believe abortion should be legal,2,1519309623160889347
449,"RT #3 In 2007, a group of religious-right activists organized a presidential debate for GOP candidates. The debate opened with a choir singing a song called ""Why Should God Bless America?"" that railed against abortion and the lack of prayer in schools. ",Neutral to abortion rights/restrictions,0,1471923084055781383
450,Just because a doctor is performing an abortion doesn't mean it's not also a murder as egregious as a parent doing so in their house,Strongly believe abortion should be illegal,-2,1483649923304210435
451,RT The Texas abortion ban is more of the same: It's about forcing Americans to live in terror of their nosy right wing neighbors. ,Neutral to abortion rights/restrictions,0,1460813947179782148
452,"RT Rand Paul is also running for reelection on vilifying Fauci. I havent heard from any Republican this year about what they want to achieve in office to help their constituents, only what theyre against science, history, voting, LGBTQ and reproductive rights.",Neutral to abortion rights/restrictions,0,1505604319407661060
453,"Sire, you are one of the wisest people on the subject of Wh Sup that I have ever heard. However, I need you to show me in the King James Bible from 1611, where the Supreme Being says he approves abortions. Ici e mon proof dat u r wrong! ",Strongly believe abortion should be illegal,-2,1467218027464867841
454,I just want to hit my head on the wall. All she wanted this morning was to put her plug in for her Friends novel. The abortion issue the conversion issue would have been enough I would think to steer her in a diff. direction but IMO it is any vote to get PM Trudeau out of office.,Neutral to abortion rights/restrictions,0,1437117705476132865
455,RT Theres a reason I was the youngest of 7 born in 10 years & why in my neighborhood there were ^three* Catholic families with 12 children. Its ungodly. You cannot provide for all the them. Constant stress. Moms dr. kicked her out of his office when she asked about birth control.,Strongly believe abortion should be legal,2,1538270982753988611
456,RT Biden is wrong. Guns are not the number one killer of children. Abortion is,Strongly believe abortion should be illegal,-2,1532511540930281481
457,"RT With caring about your health, we have so far covered 2 events where sensitization about Self Inject Contraceptive has been done to women aged 18-34 years. Alot has been taught on how to use it, the period, the benefits, the accessibility and much more. ",Slightly believe abortion should be legal,1,1468479787660423171
458,"Sex for humans wasnt always for pleasure, men dont last long because we are meant for conceiving. He was curious as a woman never had told him their thoughts, few let him finish in them, the lack of birth control being a factor. Im not sure to be honest.",Neutral to abortion rights/restrictions,0,1496725181397712896
459,"RT The thing about crypto is that republicans will force you to give birth and then do nothing to help sustain the actual living. From denying folks basic healthcare to blocking gun control legislation at every turn, they are the most pro-death group around.",Strongly believe abortion should be legal,2,1525955543440965635
460,So add a second type of Birth Control?! Cheaper than an abortion AND Safer! ,Slightly believe abortion should be legal,1,1521638071271370753
461,RT ::hugs:: There is a real need for abortion & women's healthcare to be treated seriously and fu,Strongly believe abortion should be legal,2,1441153810559221765
462,RT cw// pregnancy woke up with a single thought: sugar baby rey decides to mess with her birth control in hopes of keeping her sugar daddy around forever too bad she didnt know ben was already doing that because he *needs* to keep her anyway he can :-),Neutral to abortion rights/restrictions,0,1517174320182829058
463,"RT If Roe v. Wade is overturned, every person on dialysis needs to sue anyone who is a match to demand their kidney. Same for liver lobes. And blood, platelets, and bone marrow. The court will have said you have no bodily autonomy if another life depends on your body parts.",Strongly believe abortion should be legal,2,1470413057704796160
464,I have sympathy for them but it accounts for less than 3% of abortions. Birth control prevents back door abortions. It taking responsibility before having sex. I wasn't ready to be a dad at 20 but I took responsibility for unprotected sex & have a wonderful 32 year old son.,Slightly believe abortion should be illegal,-1,1485035475257671683
465,"RT Why, it profits a man nothing to give his soul for the whole world. But for an abortion-tainted vaccine? ",Neutral to abortion rights/restrictions,0,1487080455501500422
466,Also lets stop telling people what is or isnt good birth control when you know nothing of their medical history. What works for some may not work for others and thats okay.,Slightly believe abortion should be legal,1,1459320816026501132
467,"Seems to me, the only thing that changed is that it's almost election time and the democrats havnt been looking too good. So they needed a couple of platforms to run on. Nothing new, like inflation, energy or the border. Their go-to has always been abortion & gun restriction.",Neutral to abortion rights/restrictions,0,1532429451992125441
468,"If the mother would lose her life, removing the baby early, with no intention of killing it *directly*, and with every intention of giving it all the care that you can, is not an abortion.",Neutral to abortion rights/restrictions,0,1468959540800471043
469,"Sex outside of reproduction is HOW WE BECAME THE DOMINANT SPECIES. We gained the ability to choose to fuck because it feels good, and thus we created society. Abortion is just one more technological innovation that frees us further from our animal instincts.",Strongly believe abortion should be legal,2,1523788651242557440
470,Catholicism is not a democracy. The numerous erroneous people who support abortion are still erroneous. That includes you or anyone (hypothetically) who happens to support abortion contrary to the clear Catholic teaching on the matter.,Strongly believe abortion should be illegal,-2,1528088783178108934
471,RT Thinking about how our first two babies were surprises when birth control failed. Thinking about how we happily CHOSE to have those wanted yet surprise babies. 1/,Neutral to abortion rights/restrictions,0,1466523449593974784
472,RT Orgs like have met the needs of people seeking abortions for a long time. They listen to folks in their communities and are grounded in the lived experiences of their communities. Please support them instead of claiming to have new ideas to save abortion access,Strongly believe abortion should be legal,2,1471113395722240009
473,RT There is NO right to abortion in the Constitution.,Slightly believe abortion should be illegal,-1,1534606536084946948
474,Well I guess the next thing he did about Roe v Wade would be the first thing right? The last guy wanted his fucking wall he took it from pentagon funding. He didnt whine about two members of his own party and its happening on his watch and hes doing dick,Slightly believe abortion should be legal,1,1513609145139621888
475,No DEM URGES.. Not ALL.. I am behind blocking abortion after 16 weeks.. HOW ABOUT PUSHING MORE BIRTHCONTROL> IUD'S. NEVER here anything on that from DEMS> just KILL YOUR BABIES TILL BIRTH,Slightly believe abortion should be illegal,-1,1450195627003072512
476,"RT Although Trump downplayed abortion in 2016, voters w/ mostly pro-choice attitudes made up more than a fifth of his support in plenty of battleground states: 25% in Iowa 24% in Florida 24% in Pennsylvania 24% in Michigan 21% in Arizona 20% in Wisconsin 20% in Ohio",Neutral to abortion rights/restrictions,0,1466557629077983233
477,RT you cant be pro-choice and christian at the same time but you guys arent ready for that convo,Strongly believe abortion should be illegal,-2,1479829681264340995
478,"Most states in America have the most lax laws on drugs, abortion, teachers touching little kids. We've the most progressive tax system. The top 10% Americans pay almost all taxes, 50% pay nothing, the bottom 30% get paid by the top earners. The most progressive country on earth.",Strongly believe abortion should be legal,2,1520345405816377344
479,RT Oklahoma legislature passes more near-total abortion bans #JustTheNews ,Strongly believe abortion should be illegal,-2,1519800793825697793
480,"RT Oklahomas Republican legislature has enacted a bill making the performance of an abortion at any stage of pregnancy (other than to save the life of the mother) a felony punishable by up to ten years in prison along with a $100,000 fine ",Strongly believe abortion should be illegal,-2,1511713405937332231
481,"Is anyone forcing you to reproduce? Its 2021 and birth control, abstinence (or sex strikes), and having sex with women are all possible. There are your reproductive choices that prevent reproduction.",Slightly believe abortion should be illegal,-1,1451605441650200576
482,"Imagine seeking an abortion and being told that you need to wait for 5 more days. Y'know, just to think about it. is right: such a requirement is ""wrong, paternalistic, and outdated.""",Strongly believe abortion should be legal,2,1486268886949318658
483,"similarily penalized. Same for educational opportunities. So no, it's not about being pro-life. It's about anti-women's freedom to live their lives as they, not the government, choose. Rather like the Taliban, isn't it? /end",Strongly believe abortion should be legal,2,1463268299647684621
484,"RT *Insist on Black fealty *lousy schools *no school choice *abortion clinics *run down housing *no jobs *no investment *broken families Result: chronic health issues, poverty, crime, over-policing *issues created by Democrats, then exploited to get elected, decade after decade ",Strongly believe abortion should be illegal,-2,1463257556147658757
485,"RT Our hearts, minds, and solidarity are with the majority of Floridians who oppose extreme restrictions on abortion access. Thank you to everyone fighting against this draconian ban, the passage of which would impact the entire South: ",Strongly believe abortion should be legal,2,1489338028690706432
486,RT Tomorrow is #NoHumpDay and as long as we stick together plus keep finding new people and locations we can secure abortion rights. Which are women's rights. Which are human rights. Which shouldn't even have to be said aloud yet still they try to enslave us. #StrikeForChoice ,Strongly believe abortion should be legal,2,1486115092320043008
487,"RT If the Democrats dont do something to stop abortion rights backsliding 50 years while being in control of the presidency, senate, and house, theres going to be a couple generations of people who never bother to vote again, and I hardly blame them. Fucking hell.",Strongly believe abortion should be legal,2,1526324895088619537
488,"RT ""The idea [SCOTUS] would let this law sit there and not stop it is outrageous,"" says on Texas' new abo",Slightly believe abortion should be legal,1,1435029433681944577
489,"Abortion happens for a lot of different reasons, not just as a solution to failed birth control (which is not 100% effective). And the republicans are busy plotting agst birth control methods too. Maybe we should all move to Texas, since Abbott promised no more rapists there.",Slightly believe abortion should be legal,1,1523805831615365121
490,"RT https://t.co/B8O0qscP7g For religious right, abortion was a means to power as segregation lost ...",Neutral to abortion rights/restrictions,0,1522353242234966016
491,"Im not having a kid because i dont want that kid to grow up in a world where gun rights are more important than childrens lives. Further,why is a life in the womb more valuable than the life carrying it? If you want a pro-life society, it needs to be more than just pro-birth.",Strongly believe abortion should be legal,2,1467202391153856518
492,Get real. The majority of the worlds developed countries support abortion rights and cover the cost through healthcare. Its YOU who want to impose YOUR beliefs on the rest of us.,Strongly believe abortion should be legal,2,1524538018534760449
493,"RT this article incorrectly frames 15 week bans as a less extreme approach so let's make one thing clear - all abortion bans are extreme, and *any* pre viability bans have the same impact: decimating access at all stages of pregnancy ",Strongly believe abortion should be legal,2,1494794398512648202
494,RT California Senate Advances Newsom-Sponsored Gun Bill Modeled After Texas Abortion Law Democratic lawmakers approved the rule using the mechanism of the Texas abortion restriction for what they called something that keeps us safe and not #GunLaws ,Neutral to abortion rights/restrictions,0,1529591486991302656
495,"Alternatively, one can also point out the Repugnant Ugly of YOUR hypocrisy in spreading unverified info [text messages from an anonymous source that even RollingStone rejects] & the cruelty of trying to destroy a woman because she's a political opponent ",irrelevant or no opinion on abortion,99,1537279993558052866
496,Trust me one of these can change your life 1.Manhood enlargement 2.Remove abortion bad luck spells 4.Lost lover problems 6.Job promotion spell 8.Remove bad luck Please call or Whatsapp +27677171433,irrelevant or no opinion on abortion,99,1491024469527339010
497,"What happened to, ""My body, my choice.""? Or does that only apply to people who want to use abortion as birth control?",Slightly believe abortion should be illegal,-1,1447429626813460481
498,RT abortion is a blessing? no girl God doesnt bless sin. abortion saves lives? no girl a baby always dies. pregnancy kills,Strongly believe abortion should be illegal,-2,1443713301502955526
499,"RT But when it comes to abortion, you are all suddenly hardened disability advocates. Ive never seen the DUP pushing for",Neutral to abortion rights/restrictions,0,1471190298747449349
500,"Am I insane or is your tweet commenting more so on the difficulties in adoption to highlight the other side of ""pro-life"" that people may not consider. Many anti abortion protesters would cry out ""adoption!"" Without considering the real life implications.",Slightly believe abortion should be legal,1,1447341058568896512
501,"RT BREAKING Sen. Susan Collins wont support abortion-rights bill 'I support codifying Roe. Unfortunately the bill goes way beyond that. It would severely weaken the conscious exceptions that are in the current law,' Collins said ",Slightly believe abortion should be illegal,-1,1440812308700139522
502,"Complicit & Silent! ANOTHER INNOCENT 3y/o shot in her bed! AS USUAL,Not 1 peep out of you ADDRESS the Profoundly Lazy, Unemployed & Useless Gang Parasites,that have Infested & Ruined Chicago! Address BIRTH CONTROL!! Gang Failures SHOULDNT HAVE BABIES! GET EM OUT OF CHICAGO!",Strongly believe abortion should be legal,2,1533847211850842117
503,RT Every conservative Supreme Court justice lied under oath about their stance on abortion. They should be tried for perjury.,Strongly believe abortion should be legal,2,1540843451905892354
504,RT #ActForAbortion! 1. Donate to abortion funds: (@AbortionFunds) 2. Save indie clinics: (@KeepOurClinics) 3. Share abortion pill info: (@ShoutYrAbortion) 4. Pass the #WHPA: ,Strongly believe abortion should be legal,2,1491419659618643970
505,"RT 'Conservatives' who support abortion, same-sex marriage and transgender pronouns are not in any way conservative.",Strongly believe abortion should be illegal,-2,1504458891375128580
506,Where does fighting vaccine mandates and trying to orchestrate anti-abortion moves in parliament fit into that strategy ?,Slightly believe abortion should be legal,1,1468930735646068740
507,"RT imagine writing an article basically implying that repro CEOs who make six figures and dont interact with a single abortion patient care more about protecting access and providing care to patients thanthe people who do that every day, at enormous personal cost and on $16/hr",Strongly believe abortion should be legal,2,1536754004595814401
508,"Not murder? What would you call the vast majority of abortion cases, where the mothers life isnt in danger or extenuating circumstances like rape or incest? At this point you are advocating for pure evil.",Slightly believe abortion should be illegal,-1,1535081144026546177
509,"RT Justice Kavanaugh's neighbor is organizing the protest outside his home. Teacher Lacie Wooten-Holway declared ""Were about to get doomsday, so Im not going to be civil to that man at all. It is the license of the age of rage. ",Neutral to abortion rights/restrictions,0,1523787491513307137
510,Nice to see he has chosen an 'experienced ' person for THAT job. Abott can take over as Minister of Voter Supression and Secretary of the Anti-Choice and Anti-Trans Bureaus when he is done. What a douche!,Strongly believe abortion should be legal,2,1498289679296339978
511,The percentage of men who support abortion is higher than the percentage of White people who support it. Just sayin...,Neutral to abortion rights/restrictions,0,1485068981853642754
512,"Im gonna take a wild guess and say if they make abortion illegal, you wont change your opinion on it.",Neutral to abortion rights/restrictions,0,1466832611263885316
513,RT Absolutely here for the SuperBowl is actually about abortion access energy. ,Neutral to abortion rights/restrictions,0,1493007933118029827
514,"RT Since anti-abortion is predicated upon Christian beliefs, anti-abortionists are violating the First Amendment right to freedom of religion by denying abortions to people who don't share their religious beliefs. #AbortionIsHealthcare #HocusPocusSCOTUS",Strongly believe abortion should be legal,2,1466158277000151046
515,This incident occurred in Mexico three years ago. Something to do with abortion clinics.,Neutral to abortion rights/restrictions,0,1456071563334373377
